{
    "hostname": "test-small4",
    "environment": "TST",
    "location": "Italy",
    "info": {
        "hostname": "test-small3",
        "cpuModel": "Intel(R) Core(TM) i5-8265U CPU @ 1.60GHz",
        "cpuCores": 1,
        "cpuThreads": 2,
        "kernel": "5.3.0-45-generic",
        "os": "Ubuntu",
        "memoryTotal": 3,
        "swapTotal": 1,
        "cpuFrequency": "1.60GHz",
        "cpuSockets": 2,
        "coresPerSocket": 1,
        "threadsPerCore": 2,
        "kernelVersion": "5.3.0-45-generic",
        "osVersion": "18.04.4",
        "hardwareAbstraction": "VIRT",
        "hardwareAbstractionTechnology": "VMWARE"
    },
    "agentVersion": "latest",
    "tags": [],
    "schemaVersion": 1,
    "clusterMembershipStatus": {
        "oracleClusterware": false,
        "veritasClusterServer": true,
        "sunCluster": false,
        "hacmp": false
    },
    "filesystems": [
        {
            "filesystem": "/dev/sda1",
            "size": 511705088,
            "mountedOn": "/boot",
            "availableSpace": 335544320,
            "usedSpace": 139460608,
            "type": "ext4"
        }
    ],
    "features": {},
    "clusters": null
}