{
    "hostname": "test-small2",
    "environment": "DEV",
    "location": "Italy",
    "info": {
        "hostname": "test-small2",
        "cpuModel": "Intel(R) Xeon(R) CPU           E5630  @ 2.53GHz",
        "cpuCores": 1,
        "cpuThreads": 2,
        "kernel": "3.10.0-514.el7.x86_64",
        "os": "Red Hat Enterprise Linux",
        "memoryTotal": 3,
        "swapTotal": 1,
        "cpuFrequency": "2.53GHz",
        "cpuSockets": 2,
        "coresPerSocket": 1,
        "threadsPerCore": 2,
        "kernelVersion": "3.10.0-514.el7.x86_64",
        "osVersion": "7.6",
        "hardwareAbstraction": "VIRT",
        "hardwareAbstractionTechnology": "VMWARE"
    },
    "agentVersion": "latest",
    "tags": [],
    "schemaVersion": 1,
    "clusterMembershipStatus": {
        "oracleClusterware": false,
        "veritasClusterServer": false,
        "sunCluster": false,
        "hacmp": false
    },
    "filesystems": [
        {
            "filesystem": "/dev/sda1",
            "size": 511705088,
            "mountedOn": "/boot",
            "availableSpace": 335544320,
            "usedSpace": 139460608,
            "type": "ext4"
        }
    ],
    "features": {},
    "clusters": null
}